title,website,phone,address,content,Emails
La Unidarx,http://instagram.com/unidarx,,"Calle Salvador Díaz Mirón 114, entre Sta María la Ribera, Sta María la Ribera, Cuauhtémoc, 06400 Ciudad de México, CDMX, México",Error scraping content,Error extracting emails
Universidad Da Vinci,https://udavinci.edu.mx/,+52 55 5557 0307,"Laguna de Términos 221b-Piso 14, Granada, Miguel Hidalgo, 11520 Ciudad de México, CDMX, México",Error scraping content,Error extracting emails
Tao University,http://www.taouniversity.mx/,,"Av. Pdte. Masaryk 512, Polanco, Polanco V Secc, Miguel Hidalgo, 11530 Ciudad de México, CDMX, México",Error scraping content,Error extracting emails
Consejo de Acreditación en Programas Educativos en Matemáticas CAPEM,http://www.capem.org.mx/,+52 55 2656 5909,"Los Cipreses 122, San Andrés Totoltepec, Tlalpan, 14400 Ciudad de México, CDMX, México",Error scraping content,Error extracting emails
Mentor Praxis,https://www.mentorpraxis.com.mx/,+52 55 4415 0559,"Bosque de los Ciruelos 278, Bosque de las Lomas, Miguel Hidalgo, 11700 Ciudad de México, CDMX, México",Error scraping content,Error extracting emails
Academia Mexicana de Ciencias,http://www.amc.mx/,+52 55 5849 4905,"Los Cipreses s/n, km 23.5 de la carretera federal, San Andrés Totoltepec, Tlalpan, 14400 Ciudad de México, CDMX, México",Error scraping content,Error extracting emails
Curso de Ingreso a UNAM y Comipems,http://www.ebys.com.mx/,+52 55 4957 5655,"Av. Guadalupe I. Ramírez 502, Tierra Nueva, Xochimilco, 16050 Ciudad de México, CDMX, México",Error scraping content,Error extracting emails
EBYS,http://www.ebys.com.mx/,+52 55 5676 0508,"Av. Guadalupe I. Ramírez 502, Tierra Nueva, Xochimilco, 16050 Ciudad de México, CDMX, México",Error scraping content,Error extracting emails
Regularizacion Todas Las Materias Y Niveles,http://ebys.com.mx/,+52 55 5676 0508,"Av. Guadalupe I. Ramírez 502, Tierra Nueva, Xochimilco, 16050 Ciudad de México, CDMX, México",Error scraping content,Error extracting emails
Facultad de Derecho de la Ciudad de México,https://www.facebook.com/FACDERCDMX/,+52 55 3728 4452,"Av. División del Nte. 3011, El Rosedal, Coyoacán, 04330 Ciudad de México, CDMX, México",Error scraping content,Error extracting emails
Universidad para el Bienestar Benito Juárez García Sede Xochimilco,https://ubbj.gob.mx/,+52 55 9036 2214,"San Bernardino 121, Potrero de San Bernardino, Xochimilco, 16030 Ciudad de México, CDMX, México",Error scraping content,Error extracting emails
C.E.I.E.P.Av,http://www.fmvz.unam.mx/,,"Salvador Díaz Mirón 65, Santa Ana Poniente, Tláhuac, 13300 Ciudad de México, CDMX, México",Error scraping content,Error extracting emails
"Escuela Nacional Preparatoria N° 4 ""Vidal Castañeda y Najera"" UNAM",http://enp4.unam.mx/,+52 55 5277 0848,"Av Observatorio 170, Observatorio, Miguel Hidalgo, 11860 Ciudad de México, CDMX, México",Error scraping content,Error extracting emails
Personal English,http://www.personalenglish.com.mx/,+52 55 5850 9577,"Rojo Gómez 3, Granjas Cabrera, Tláhuac, 13230 Ciudad de México, CDMX, México",Error scraping content,Error extracting emails
Universidad Tecnológica Laja Bajío,http://utlajabajio.edu.mx/sitio/view/quienes-somos.php,+52 461 287 4563,"Av. Rodolfo Neri Vela 401, Bosque de Chapultepec II Secc, Miguel Hidalgo, 11100 Santa María del Refugio, CDMX, México",Error scraping content,Error extracting emails
Vacunación COVID-19 - Universidad Marista,https://vacunacion.cdmx.gob.mx/,+52 55 5658 1111,"Canal de Chalco 928, Col del Mar, Tláhuac, 13270 Ciudad de México, CDMX, México",Error scraping content,Error extracting emails
UNIVERMILENIUM CORPORATIVO,http://univermilenium.edu.mx/,,"Galileo 101, Polanco, Polanco IV Secc, Miguel Hidalgo, 11550 Ciudad de México, CDMX, México",Error scraping content,Error extracting emails
IMES México S. C.,http://www.imesmexico.org/,,"C. Montes Urales, Lomas - Virreyes, Lomas de Chapultepec III Secc, Miguel Hidalgo, 11000 Ciudad de México, CDMX, México",Error scraping content,Error extracting emails
Dependencia de la Universidad Nacional Autonoma de México,https://www.unam.mx/,+52 55 5845 0029,"Salvador Díaz Mirón 89, Santa Ana Poniente, Tláhuac, 09790 Ciudad de México, CDMX, México",Error scraping content,Error extracting emails
Projects México,http://www.projectmexico.com.mx/,+52 56 2632 1419,"C. Montes Urales 505, Lomas - Virreyes, Lomas de Chapultepec III Secc, Miguel Hidalgo, 11000 Ciudad de México, CDMX, México",Error scraping content,Error extracting emails
IE University - Mexico Office,https://www.ie.edu/programs/?utm_medium=social&utm_source=gmb&utm_campaign=ieteam_feed_camp_en_ww_lead_comm_prod_allu_alle_allpw_allp&utm_term=ieteam,+52 55 8647 0123,"C/ Pedregal 24, Torre Virreyes, Piso 3, Oficina 321, Molino del Rey, 11040 Ciudad de México, CDMX, México",Error scraping content,Error extracting emails
Curso Aragonés UNAM Plantel Oceania,https://www.facebook.com/CursoAragonesUNAM,+52 55 4846 8796,"Nte. 178 637, Pensador Mexicano, Venustiano Carranza, 15510 Ciudad de México, CDMX, México",Error scraping content,Error extracting emails
"CENTRO | Diseño, Cine y Televisión",https://www.centro.edu.mx/,+52 55 2789 9000,"Av Constituyentes 455, América, Miguel Hidalgo, 11820 Ciudad de México, CDMX, México",Error scraping content,Error extracting emails
Universidad Mexicana - UNIMEX Plantel Polanco,http://unimex.edu.mx/,+52 55 1102 0290,"Av. Emilio Castelar 83, Polanco, Polanco IV Secc, Miguel Hidalgo, 11550 Ciudad de México, CDMX, México",Error scraping content,Error extracting emails
Instituto Gestal de Puebla,http://www.gestalthumanista.com/,+52 222 248 4107,"37 Sur 1501, Ampliación Belza5rio Dominguez, Gustavo A. Madero, 72180 Puebla, Pue., México",Error scraping content,Error extracting emails
clases a domicilio EDUCERE,https://clases-educere.com.mx/,+52 55 5934 1156,"Nte. 80 5203-Interior 4, Gertrudis Sánchez II Secc, Gustavo A. Madero, 07839 Ciudad de México, CDMX, México",Error scraping content,Error extracting emails
Capacitación Burmed Educación Financiera y Bursátil.,https://www.facebook.com/profile.php?id=100087430951023,+52 55 1732 7335,"Av. 551 145, San Juan de Aragon, Gustavo A. Madero, 07969 Ciudad de México, CDMX, México",Error scraping content,Error extracting emails
Ciencia Política y Administración Urbana,https://www.uacm.edu.mx/Oferta_academica/CHyCS/Licenciaturas/CPyAU,+52 55 7058 4353,"Tlacaelel 1, Loma la Palma, Gustavo A. Madero, 07160 Ciudad de México, CDMX, México",Error scraping content,Error extracting emails
UNIVERSIDAD CNCI TLAHUAC,https://www.cnci.edu.mx/propios/tlahuac/,+52 55 2160 0126,"Av. la Turba 564, Miguel Hidalgo, Tláhuac, 13200 Tlahuac, CDMX, México",Error scraping content,Error extracting emails
"Universidad Del Valle De México, S.C.",https://uvm.mx/,+52 55 9138 5000,"Campos Elíseos 223, Polanco, Polanco V Secc, Álvaro Obregón, 01060 Ciudad de México, CDMX, México",Error scraping content,Error extracting emails
URC,https://rcastellanos.cdmx.gob.mx/,,"San Juan de Aragón II Secc, Gustavo A. Madero, 07979 Ciudad de México, CDMX, México",Error scraping content,Error extracting emails
Universidad cesca,http://cesca.mx/,,"constitución local 206 plaza la 3ra, C. 3, México",Error scraping content,Error extracting emails
Escuela de Altos Estudios en Salud,http://lasalle.mx/,+52 55 5278 9500,"Sta Teresa, Tlalpan, 14010 Ciudad de México, CDMX, México",Error scraping content,Error extracting emails
Flacso Mexico,https://www.flacso.edu.mx/,+52 55 3000 0200,"Carr. Picacho-Ajusco 377, Héroes de Padierna, Tlalpan, 14200 Ciudad de México, CDMX, México",Error scraping content,Error extracting emails
Universidad Tecmilenio Ferrería,https://universidad.tecmilenio.mx/campus-ferreria-tecmilenio,+52 55 2626 5050,"Av. de las Granjas 800, Santa Barbara, Azcapotzalco, 02230 Ciudad de México, CDMX, México",Error scraping content,Error extracting emails
Centro Educativo Nous,https://www.facebook.com/profile.php?id=100092351390941,+52 55 4138 5496,"Club Deportivo Universidad 29 A, Coapa, Villa Lázaro Cárdenas, Tlalpan, 14370 Ciudad de México, CDMX, México",Error scraping content,Error extracting emails
EGADE Business School,http://www.egade.mx/,+52 55 5483 1619,"C. Puente #222, Coapa, Arboledas del Sur, Tlalpan, 14360 Ciudad de México, CDMX, México",Error scraping content,Error extracting emails
Instituto Tecnologico Roosevelt Plantel Tlalpan,http://www.roosevelt.edu.mx/,+52 55 5549 1913,"Calz. de Tlalpan 4379, Huipulco, Tlalpan, 14370 Ciudad de México, CDMX, México",Error scraping content,Error extracting emails
Instituto Latinoamericano de la Comunicación Educativa,https://www.ilce.edu.mx/,+52 55 5020 6500,"C. Puente 45, Coapa, Arboledas del Sur, Tlalpan, 14380 Ciudad de México, CDMX, México",Error scraping content,Error extracting emails
Escuela de Enfermería María Elena Maza Brito,https://www.escuelaenfermeriamemb.edu.mx/,+52 55 5487 0900,"Vasco de Quiroga 15, Belisario Domínguez Secc 16, Tlalpan, 14080 Ciudad de México, CDMX, México",Error scraping content,Error extracting emails
CIESAS,https://ciesas.edu.mx/,+52 55 5487 3690,"C. Niño Jesús 251, La Joya, Tlalpan, 14090 Ciudad de México, CDMX, México",Error scraping content,Error extracting emails
Seminario Conciliar de México,http://www.conciliar.mx/,+52 55 5573 2222,"Guadalupe Victoria 133, Tlalpan Centro I, Tlalpan, 14000 Ciudad de México, CDMX, México",Error scraping content,Error extracting emails
Kapta Asesorías Académicas,https://m.facebook.com/kapta.asesoriasacademicas/,+52 55 5603 1228,"Calz. de las Bombas 887, Coapa, Cafetales II, Coyoacán, 04909 Ciudad de México, CDMX, México",Error scraping content,Error extracting emails
Escuela de Dietética y Nutrición,https://edn.issste.gob.mx/,+52 55 5665 8056,"Callejon Via, Av. San Fernando No. 12, San Pedro Apostol, Tlalpan, 14070 CDMX, México",Error scraping content,Error extracting emails
ESCA - Escuela Superior de Comercio y Administración Unidad Tepepan IPN,https://www.escatep.ipn.mx/,+52 55 5729 6000,"4863 Anillo Periférico, Sur Manuel Gómez Morín, Amp Tepepan, 16020 Ciudad de México, México",Error scraping content,Error extracting emails
"Escuela Nacional Preparatoria N° 5 ""José Vasconcelos"" UNAM",http://132.247.137.242/Home/,+52 55 5678 2096,"Calz. del Hueso 729, Coapa, Ex-Hacienda Coapa, Tlalpan, 14300 Ciudad de México, CDMX, México",Error scraping content,Error extracting emails
UVM Hospital Veterinario - Universidad del Valle de México,https://uvm.mx/hospital-veterinario-uvm?utm_source=GOOGLE_MY_BUSINESS&utm_medium=ORGANIC&utm_campaign=GM_UVM&utm_term=HOSPITAL&utm_content=VETERINARIO,+52 55 5599 2626,"Calz. de Tlalpan 3058, Coapa, Sta. Úrsula Coapa, Coyoacán, 04910 Ciudad de México, CDMX, México",Error scraping content,Error extracting emails
ESIME - Escuela Superior de Ingeniería Mecánica y Eléctrica Unidad Culhuacán,https://www.esimecu.ipn.mx/,+52 55 5624 2000,"Av. Sta. Ana 1000, San Francisco Culhuacan, Culhuacan CTM V, Coyoacán, 04440 Ciudad de México, CDMX, México",Error scraping content,Error extracting emails
CEEC | Centro de Estudios Cafetales,http://ceeccafetales.edu.mx/,+52 55 5673 6170,"Armada de Mexico 1394, Coapa, Cafetales I, Coyoacán, 04918 Ciudad de México, CDMX, México",Error scraping content,Error extracting emails
Centro Escolar Cedros,https://www.colegios-cedros-yaocalli.mx/cedros?utm_source=google&utm_medium=organic&utm_campaign=maps&utm_term=sitio&utm_content=cedros,+52 55 5091 9500,"Tecoyotitla 364, Ex, Hacienda de Guadalupe Chimalistac, 01050 Ciudad de México, México",Error scraping content,Error extracting emails
EDEN Coyoacán Escuela de Entrenadores de Acondicionamiento Físico y Fitness,https://www.escueladeentrenadores.com.mx/toma-1-clase-de-prueba-gratis/,+52 56 1113 7920,"CALLE ESQUINA, Aguayo, Del Carmen, 04100 Ciudad de México, CDMX, México",Error scraping content,Error extracting emails
Escuela de Natación Club Cañada,https://www.ccnatacion.com/,+52 55 8751 4000,"Av. Revolución 1817, San Ángel, Álvaro Obregón, 01000 Ciudad de México, CDMX, México",Error scraping content,Error extracting emails
Formación Ejecutiva Empresarial - Escuela de Ventas,http://formaejecutiva.com/,+52 55 5659 0011,"Calle Cracovia 72, San Ángel, Álvaro Obregón, 01000 Ciudad de México, CDMX, México",Error scraping content,Error extracting emails
"Escuela Nacional Preparatoria N° 8 ""Miguel E. Schulz"" UNAM",http://prepa8.unam.mx/,+52 55 5593 6714,"Av. Lomas De Plateros S/N, Merced Gómez, Álvaro Obregón, 01600 Ciudad de México, CDMX, México",Error scraping content,Error extracting emails
Escuela de Técnica Alexander México,http://www.tecnicaalexander.mx/,+52 55 2095 6301,"01020, Guadalupe Inn, 01020 Ciudad de México, CDMX, México",Error scraping content,Error extracting emails
Escuela de Natación Club Cañada,https://www.ccnatacion.com/,+52 55 8751 4000,"C. Gabriel Mancera 1620, Col del Valle Centro, Benito Juárez, 03104 Ciudad de México, CDMX, México",Error scraping content,Error extracting emails
The Churchill School,https://www.churchill.edu.mx/,+52 55 5028 8800,"Felipe Villanueva 36, Guadalupe Inn, Álvaro Obregón, 01020 Ciudad de México, CDMX, México",Error scraping content,Error extracting emails
Secundaria CEAM Ciudad de México,http://www.ceam.edu.mx/mexico/,+52 55 5593 0188,"Calz. de las Águilas 272, Águilas, Álvaro Obregón, 01710 Ciudad de México, CDMX, México",Error scraping content,Error extracting emails
IPM Montessori Florida,https://www.ipmmontessori.edu.mx/,+52 55 5661 1005,"Hortensia 101, Florida, Álvaro Obregón, 01030 Ciudad de México, CDMX, México",Error scraping content,Error extracting emails
BridgeWay North American School,http://bridgewaymexico.com/,+52 56 3403 7474,"Carrillo Puerto 344, Gral Anaya, Benito Juárez, 03340 Ciudad de México, CDMX, México",Error scraping content,Error extracting emails
Helios Escuela de Artes Escénico Aéreas,http://helios-escuela-de-artes-escenico-aereas.business.site/,+52 55 6427 9239,"Av Centenario 18, Merced Gómez, Álvaro Obregón, 01600 Ciudad de México, CDMX, México",Error scraping content,Error extracting emails
Escuela Oficial Rayados Coyoacán,https://sites.google.com/view/rayadoscoyoacan/p%C3%A1gina-principal,+52 55 2909 5654,"Londres 188, Del Carmen, Coyoacán, 04100 Ciudad de México, CDMX, México",Error scraping content,Error extracting emails
Colegio Chimalistac,https://www.ecagrupoeducativo.mx/chimalistac,+52 55 5661 5589,"Arenal 36, Agrícola, Chimalistac, Álvaro Obregón, 01050 Ciudad de México, CDMX, México",Error scraping content,Error extracting emails
Lólindir Primaria,http://www.lolindir-primaria.org/,+52 55 5593 3489,"Cuajimalpa 21, Merced Gómez, Álvaro Obregón, 01401 Ciudad de México, CDMX, México",Error scraping content,Error extracting emails
Escuela Moderna Americana,http://www.modernamerican.edu.mx/,+52 55 5658 4766,"Cerro del Hombre 18, Romero de Terreros, Coyoacán, 04310 Ciudad de México, CDMX, México",Error scraping content,Error extracting emails
Escuela Primaria Lic. Protasio Tagle,http://www.sep.gob.mx/swb/sep1/,+52 55 9131 7671,"esq. Cuauhtémoc, Centenario 28, Del Carmen, Coyoacán, 04100 Ciudad de México, CDMX, México",Error scraping content,Error extracting emails
Escuela Primaria Prof Ponciano Rodriguez,http://www.sep.gob.mx/,+52 55 3601 7175,"Real Mayorazgo 80, Xoco, Benito Juárez, 03330 Ciudad de México, CDMX, México",Error scraping content,Error extracting emails
Colegio Nueva Escocia,http://www.nuevaescocia.edu.mx/,+52 55 5660 1249,"Miguel Ocaranza 121, Merced Gómez, Álvaro Obregón, 01600 Ciudad de México, CDMX, México",Error scraping content,Error extracting emails
Händel School,http://www.handelschool.edu.mx/,+52 55 5688 9447,"San Felipe 72, Xoco, Benito Juárez, 03330 Ciudad de México, CDMX, México",Error scraping content,Error extracting emails
ENMJN - Escuela Nacional para Maestras de Jardines de Niños,https://www.aefcm.gob.mx/dgenam/ENMJN/index.html,+52 55 5593 6120,"Calle Gustavo E. Campa 94, Guadalupe Inn, Álvaro Obregón, 01020 Ciudad de México, CDMX, México",Error scraping content,Error extracting emails
Escuela Arenal,https://www.arenalarteycrianza.com/,+52 55 5554 4486,"Av Miguel Hidalgo 229, Del Carmen, Coyoacán, 04100 Ciudad de México, CDMX, México",Error scraping content,Error extracting emails
Escuela Primaria Luis R. Alarcon,http://www.sep.gob.mx/,+52 55 3601 7599,"Av Centenario 88 Bis, Merced Gómez, Álvaro Obregón, 01600 Ciudad de México, CDMX, México",Error scraping content,Error extracting emails
Escuela Primaria Matilde Acosta,http://matildeacosta.blogspot.mx/,+52 55 5651 6449,"Manzanas G, Lomas de Plateros, Álvaro Obregón, 01480 Ciudad de México, CDMX, México",Error scraping content,Error extracting emails
Alive School,https://aliveschool.mx/,+52 55 5544 3221,"Viena 241, Del Carmen, Coyoacán, 04100 Ciudad de México, CDMX, México",Error scraping content,Error extracting emails
"Escuela Secundaria Diurna N° 72 ""Diego Rivera""",http://www.sep.gob.mx/#newcomment,+52 55 5604 6723,"Cda. de Popocatépetl 56, Xoco, Benito Juárez, 03330 Ciudad de México, CDMX, México",Error scraping content,Error extracting emails
"Escuela Secundaria Diurna N° 68 ""Maestro Gabino A. Palma""",http://sep.gob.mx/,+52 55 5801 3153,"C. Corregidora S/N, Tlacopac, Álvaro Obregón, 01049 Ciudad de México, CDMX, México",Error scraping content,Error extracting emails
Escuela Primaria Manuel Cervantes Imaz,http://sosmex.jimdo.com/,+52 55 2580 3908,"Natal Pesado 8, Mixcoac, Benito Juárez, 03910 Ciudad de México, CDMX, México",Error scraping content,Error extracting emails
Primaria Queen Elizabeth School,http://www.qes.edu.mx/,+52 55 5651 7888,"Condor 198, Los Alpes, Álvaro Obregón, 01010 Ciudad de México, CDMX, México",Error scraping content,Error extracting emails
"IEMS Plantel Magdalena Contreras ""Ignacio Manuel Altamirano""",http://www.iems.edu.mx/,+52 55 5667 3658,"Av. San Jerónimo 2625, San Bernabé Ocotepec, La Magdalena Contreras, 10300 Ciudad de México, CDMX, México",Error scraping content,Error extracting emails
"Escuela Primaria ""Xicotencatl""",https://www2.aefcm.gob.mx/directorio_escuelas/cct_mas_gbmx.jsp?cve_cct=09DPR1904I,+52 55 5035 8990,"Emiliano Zapata 4, San Bernabé Ocotepec, La Magdalena Contreras, 10300 Ciudad de México, CDMX, México",Error scraping content,Error extracting emails
Escuela de Capacitación para el Desarrollo de las Habilidades del Aprendizaje,https://escuela-crecer.ueniweb.com/,,"Emiliano Zapata 5, Ampliación Potrerillo, Amp. Potrerillo, La Magdalena Contreras, 10368 Ciudad de México, CDMX, México",Error scraping content,Error extracting emails
"Escuela Primaria ""Rabindranath Tagore""",http://www.sep.gob.mx/,+52 55 2650 2213,"Av 29 de Octubre S/N, Lomas de la Era, Álvaro Obregón, 01860 Ciudad de México, CDMX, México",Error scraping content,Error extracting emails
"Escuela Primaria ""Miguel Hidalgo y Costilla""",https://www.facebook.com/groups/197125202125515/?ref=share,+52 55 5862 1306,"Abasolo, San Pablo Oztotepec, San Miguel, Milpa Alta, 12400 San Pablo Oztotepec, CDMX, México",Error scraping content,Error extracting emails
Conalep SECOFI,http://cdmx.conalep.edu.mx/,+52 55 5667 1241,"Av. Ojo de Agua S/N, Huayatla, El Ermitaño, La Magdalena Contreras, 10350 Ciudad de México, CDMX, México",Error scraping content,Error extracting emails
"IEMS Plantel Milpa Alta ""Emiliano Zapata""",http://www.iems.edu.mx/,+52 55 5636 2500,"Temixco, Santa Ana Tlacotenco, La Guadalupita, 12900 Ciudad de México, CDMX, México",Error scraping content,Error extracting emails
Escuela Particular Plan De Ayala,https://www.facebook.com/Esc-Plan-de-Ayala-101765494801191/,+52 55 5862 0616,"Av. Morelos Pte. 38, San Pablo Oztotepec, San Miguel, Milpa Alta, 12400 San Pablo Oztotepec, CDMX, México",Error scraping content,Error extracting emails
"Escuela Primaria ""Plan Sexenal""",https://www.facebook.com/groups/828607267996909/?ref=share,,"Cda. Emiliano Zapata, San Pablo Oztotepec, San Miguel, Milpa Alta, 12400 San Pablo Oztotepec, CDMX, México",Error scraping content,Error extracting emails
"Escuela Secundaria Diurna N° 254 ""Nagoya""",http://sec254nagoya.blogspot.com/,,"Vereda Nacional 87, Popotla, Miguel Hidalgo, 11400 Ciudad de México, CDMX, México",Error scraping content,Error extracting emails
"Escuela Secundaria Diurna N° 25 ""Fernando Montes de Oca""",http://p3df.mex.tl/,,"Esq. Fresnos, Calz. Puente de Guerra, Pasteros, 02150 Ciudad de México, México",Error scraping content,Error extracting emails
EASY DRIVE: Escuela de manejo,https://www.escuelaeasydrive.com.mx/,+52 55 4071 2845,"Hacienda Escolástica 87, Hacienda del Rosario, El Rosario, Azcapotzalco, 02420 Ciudad de México, CDMX, México",Error scraping content,Error extracting emails
AFEEG Academia de Formacion Especializada de Escoltas y Guardaespaldas,https://www.afeeg.com/,+52 55 2126 6994,"16 de Septiembre No. 39, Col del Recreo. Del, Azcapotzalco, 02000 Ciudad de México, CDMX, México",Error scraping content,Error extracting emails
ESIME - Escuela Superior de Ingeniería Mecánica y Eléctrica Unidad Azcapotzalco IPN,https://www.esimeazc.ipn.mx/,+52 55 5729 6000,"Av. de las Granjas 682, Santa Catarina, Azcapotzalco, 02550 Ciudad de México, CDMX, México",Error scraping content,Error extracting emails
"Escuela de Box ""Aquiles Serdán""",https://www.facebook.com/ESCUELA.BOX.CONDE.AQUILES.SERDAN/,,"Av. Aquiles Serdán 231, Santo Domingo, Azcapotzalco, 02160 Ciudad de México, CDMX, México",Error scraping content,Error extracting emails
Escuela Secundaria Técnica N° 62,https://sites.google.com/view/est62/p%C3%A1gina-principal,+52 55 5925 8527,"Calz. de los Angeles 201, Santa Barbara, Azcapotzalco, 02230 Ciudad de México, CDMX, México",Error scraping content,Error extracting emails
"Escuela Secundaria Diurna N° 67 ""John F. Kennedy""",http://secundaria67.blogspot.mx/,+52 55 9155 2253,"Francita 143, Petrolera, Azcapotzalco, 02480 Ciudad de México, CDMX, México",Error scraping content,Error extracting emails
"IEMS Plantel Azcapotzalco I ""Melchor Ocampo""",http://www.iems.edu.mx/,+52 55 5383 5428,"Calle Rosario esq. & Calle Hidalgo S/N, Santa Catarina, Azcapotzalco, 02250, México",Error scraping content,Error extracting emails
"Escuela Secundaria Diurna N° 143 ""Ermilo Abreu Gomez""",https://www.facebook.com/ErmiloAbreuGomez143Oficial/,+52 55 8989 2255,"Manuel Salazar S/n, Providencia, Azcapotzalco, 02440 Ciudad de México, CDMX, México",Error scraping content,Error extracting emails
Centro Escolar Lancaster,http://www.celancaster.edu.mx/,+52 55 5240 7966 ext. 202,"Hacienda Escolástica 66, Col. Ampliación, Providencia, Azcapotzalco, 02440 Azcapotzalco, CDMX, México",Error scraping content,Error extracting emails
"Escuela Secundaria Diurna N° 54 ""República de Bolivia""",http://www.sep.gob.mx/,,"Jerusalén S/N, Centro de Azcapotzalco, Azcapotzalco, 02000 Ciudad de México, CDMX, México",Error scraping content,Error extracting emails
Colegio Amauta De Landázuri,http://www.colegiolandazuri.edu.mx/,+52 55 8933 3541,"C. Heliópolis 210, Claveria, Azcapotzalco, 02080 Ciudad de México, CDMX, México",Error scraping content,Error extracting emails
ESCUELA DE ELECTRONICA Y COMPUTACION PROFESOR GUILLERMO OROZCO,http://www.multiserviciosdeoro.com/,+52 55 5220 3540,"Priv. Demócrata 8, Col del Recreo, Azcapotzalco, 02070 Ciudad de México, CDMX, México",Error scraping content,Error extracting emails
"Escuela Secundaria Diurna N° 108 ""Bertrand Russell""",https://www.secundaria108.online/,+52 55 5561 7619,"Campo Ídolos 62, San Antonio, Azcapotzalco, 02720 Ciudad de México, CDMX, México",Error scraping content,Error extracting emails
Escuela de Gastronomía Mariano Moreno,https://lg.ismm.com.mx/?gad_source=1&gclid=Cj0KCQjw0MexBhD3ARIsAEI3WHKssT_aDXZkRHtBL0QGkhaFphIqeVdoUStYeySNg9awOHUZHN0fHucaArlgEALw_wcB,,"Av. Moliere 450A-B-C, Amp Granada, Miguel Hidalgo, 11529 Ciudad de México, CDMX, México",Error scraping content,Error extracting emails
Escuela de poligrafía,http://www.escueladepoligrafia.com/,+52 55 4588 5203,"Av. Homero 229, Polanco, ms3, Miguel Hidalgo, 11560 Ciudad de México, CDMX, México",Error scraping content,Error extracting emails
"Escuela Secundaria Técnica N° 27 ""Alberto J. Pani""",http://www.sep.gob.mx/,+52 55 5561 5811,"Gral. G. Sánchez 33, San Juan Tlihuaca, Azcapotzalco, 02400 Ciudad de México, CDMX, México",Error scraping content,Error extracting emails
Telpuchcalli,http://telpuchcalli.com/,,"Esquina con, Av. Azcapotzalco, Calle Otoño 50, C. Otoño 46, Ángel Zimbrón, Azcapotzalco, 02099 Ciudad de México, CDMX, México",Error scraping content,Error extracting emails
Escuela podológica de México,http://www.podologiaepm.edu.mx/,+52 55 5341 7622,"Calz. Gral. Mariano Escobedo 5 Bis, Popotla, Miguel Hidalgo, 11400 Ciudad de México, CDMX, México",Error scraping content,Error extracting emails
Escuela Despierta,http://www.escueladespierta.com/,+52 55 4194 4789,"Calz. San Bartolo Naucalpan, Argentina Poniente, Miguel Hidalgo, 11219 Ciudad de México, CDMX, México",Error scraping content,Error extracting emails
PRIMARIA FERNANDO MONTES DE OCA,http://www.sep.gob.mx/,+52 55 3601 1000,"Víctor Hernández S/N, Francisco Villa, Azcapotzalco, 02420 Ciudad de México, CDMX, México",Error scraping content,Error extracting emails
Escuela Primaria El Niño Agrarista,http://p3df.mex.tl/,+52 55 5561 2018,"Campo Maluco 9, San Antonio, Azcapotzalco, 02720 Ciudad de México, CDMX, México",Error scraping content,Error extracting emails
Primaria Candido Navarro,https://candido-navarro.jimdosite.com/,+52 55 5394 4116,"Eje 4 Nte. (Calz. Azcapotzalco La Villa), Santa Catarina, Azcapotzalco, 02250 Ciudad de México, CDMX, México",Error scraping content,Error extracting emails
