title,website,phone,address,content,Emails
ESCA - Escuela Superior de Comercio y Administración Unidad Santo Tomás,https://www.escasto.ipn.mx/,+52 55 5729 6000,"Manuel Carpio 471, Plutarco Elías Calles, Miguel Hidalgo, 11350 Ciudad de México, CDMX, México",Error scraping content,Error extracting emails
ESIME Ticoman,https://www.esimetic.ipn.mx/,+52 55 5729 6000,"Calz. Ticomán 600, La Purísima Ticoman, Gustavo A. Madero, 07340 Ciudad de México, CDMX, México",Error scraping content,Error extracting emails
Clínica Odontológica UNITEC Marina - Universidad Tecnológica de México,https://www.unitec.mx/clinica-de-odontologia/?utm_source=GOOGLE_MY_BUSINESS&utm_medium=ORGANIC&utm_campaign=GM_CLI_ODO_UNITEC&utm_term=CLINICA_ODONTOLOGICA&utm_content=PRESTIGIO,+52 55 5329 7600,"Av. Marina Nacional 162, Lago Iseo 50, Anáhuac I Secc, 11320 Ciudad de México, CDMX, México",Error scraping content,Error extracting emails
URC Justo Sierra,https://rcastellanos.cdmx.gob.mx/,,"Justo Sierra 53, Centro Histórico de la Cdad. de México, Centro, Cuauhtémoc, 06000 Ciudad de México, CDMX, México",Error scraping content,Error extracting emails
Universidad del Claustro de Sor Juana,https://elclaustro.mx/,+52 55 5130 3300,"José María Izazaga 92, Centro Histórico de la Cdad. de México, Centro, Cuauhtémoc, 06080 Ciudad de México, CDMX, México",Error scraping content,Error extracting emails
Departamento de Control Automático,http://www.ctrl.cinvestav.mx/,+52 55 5747 3800,"Av Instituto Politécnico Nacional 2508, San Pedro Zacatenco, Gustavo A. Madero, 07360 Ciudad de México, CDMX, México",Error scraping content,Error extracting emails
"Departamento de Fisiología, Biofísica y Neurociencias",http://www.fisio.cinvestav.mx/,,"Av. IPN 2508, San Pedro Zacatenco, 07360 Ciudad de México, CDMX, México",Error scraping content,Error extracting emails
Departamento de Ciencia de Materiales ESFM,http://www.esfm.ipn.mx/,,"s/n, 07738 de, Av Instituto Politécnico Nacional, Lindavista, Gustavo A. Madero, Ciudad de México, México",Error scraping content,Error extracting emails
Centro De Innovación Y Desarrollo Tecnológico En Cómputo,https://www.cidetec.ipn.mx/,,"Av.Juan de Dios Bátiz S/N, Nueva Industrial Vallejo, 07700 Gustavo A. Madero, CDMX, México",Error scraping content,Error extracting emails
Farmacología,http://farmacologia.cinvestav.mx/,+52 55 5747 3800,"Av Instituto Politécnico Nacional 2508, San Pedro Zacatenco, Gustavo A. Madero, 07360 Ciudad de México, CDMX, México",Error scraping content,Error extracting emails
Jefatura de Ingeniería Eléctrica,http://ie.cinvestav.mx/,+52 55 5747 3800 ext. 3750,"Av Instituto Politécnico Nacional, Lindavista, Gustavo A. Madero, 07340 Ciudad de México, CDMX, México",Error scraping content,Error extracting emails
Club de Fotografía en Ciencias de la Tierra,https://www.instagram.com/fotoclub_esia_ct,+52 55 1981 5910,"Calz. Ticomán 600, San José Ticoman, Gustavo A. Madero, 07340 Ciudad de México, CDMX, México",Error scraping content,Error extracting emails
Laboratorio 4 Química Orgánica ENCB,https://www.encb.ipn.mx/,+52 55 5729 6300,"PROLONGACION DE CARPIO, PLAN DE AYALA| Y, Santo Tomás, Miguel Hidalgo, 11350 Ciudad de México, CDMX, México",Error scraping content,Error extracting emails
ENCB - Escuela Nacional de Ciencias Biológicas Unidad Santo Tomás IPN,https://www.encb.ipn.mx/,+52 55 5729 6300,"Manuel Carpio, Plutarco Elías Calles, Miguel Hidalgo, 11350 Ciudad de México, CDMX, México",Error scraping content,Error extracting emails
Unidad Politécnica de Integración Social - ENBA IPN,https://www.facebook.com/profile.php?id=100093557064859,+52 55 5729 6000 ext. 58105,"Calz. Ticomán 645, Col. Sta. María, Ticoman, Gustavo A. Madero, 07330 Ciudad de México, CDMX, México",Error scraping content,Error extracting emails
UPIBI - Unidad Profesional Interdisciplinaria de Biotecnología IPN,https://www.upibi.ipn.mx/,+52 55 5729 6000,"Av. Acueducto, La Laguna Ticoman, Gustavo A. Madero, 07340 Ciudad de México, CDMX, México",Error scraping content,Error extracting emails
Universidad de la Conciencia Hermandad de la Diosa Blanca,https://www.hdiosablanca.org/,+52 55 3954 7339,"C. Nogal 45-Local C, Sta María la Ribera, Cuauhtémoc, 06400 Ciudad de México, CDMX, México",Error scraping content,Error extracting emails
INSTITUTO POLITÉCNICO NACIONAL,http://institutopolitecniconacional.com/,+52 55 5729 6000,"Av. Luis Enrique Erro S/N, Nueva Industrial Vallejo, Gustavo A. Madero, 07738 Ciudad de México, CDMX, México",Error scraping content,Error extracting emails
Universidad Virtual Liverpool UVL,https://universidad-virtual-liverpool.ifliverpool.edu.mx/inicio,+52 735 911 9318,"Av. Insurgentes Nte. 151, Guerrero, Cuauhtémoc, 06300 Ciudad de México, CDMX, México",Error scraping content,Error extracting emails
UPIITA - Unidad Profesional Interdisciplinaria en Ingeniería y Tecnologías Avanzadas IPN,http://www.upiita.ipn.mx/,+52 55 5729 6000,"Av Instituto Politécnico Nacional 2580, La Laguna Ticoman, Gustavo A. Madero, 07340 Ciudad de México, CDMX, México",Error scraping content,Error extracting emails
"Justo Sierra Campus Acueducto: Secundaria, Preparatoria y Universidad",https://www.justo-sierra.edu.mx/,+52 55 2351 7911,"Av. Acueducto. 914. Col. Laguna Ticomán, Alcaldía, Gustavo A. Madero, 07330 CDMX, México",Error scraping content,Error extracting emails
URC Santo Tomás,https://rcastellanos.cdmx.gob.mx/,+52 56 2382 1174,"Manuel Carpio 322, Santo Tomás, Miguel Hidalgo, 11350 Ciudad de México, CDMX, México",Error scraping content,Error extracting emails
ETAC Campus Tlatelolco,https://www.etac.edu.mx/,+52 55 1493 3677,"Manuel Gonzalez 113, entre Eje Central y Avenida Guerrero, San Simón Tolnahuac, Cuauhtémoc, 06920 Ciudad de México, CDMX, México",Error scraping content,Error extracting emails
Centro Universitario para el Liderazgo y Desarrollo Profesional,https://ce-uldp.com/,+52 55 5198 0839,"C. José Antonio Alzate 44, Sta María la Ribera, Cuauhtémoc, 06400 Ciudad de México, CDMX, México",Error scraping content,Error extracting emails
Universidad Nacional Autónoma de Mexico: Programa Universitario de Estudios sobre la Ciudad,http://www.puec.unam.mx/,+52 55 5522 2330,"República de Cuba 79, Centro Histórico de la Cdad. de México, Centro, Cuauhtémoc, 06060 Ciudad de México, CDMX, México",Error scraping content,Error extracting emails
Universidad Interglobal,https://universidadinterglobal.edu.mx/,+52 55 7806 9180,"Ignacio L. Vallarta.1 Segundo Piso. Col Tabacalera, Del Cuauhtémoc, Delegación Cuauhtémoc, 06030 Ciudad de México, CDMX, México",Error scraping content,Error extracting emails
Universidad Rosario Castellanos Campus Santo Tomás,https://rcastellanos.cdmx.gob.mx/,+52 55 4022 7867,"Manuel Carpio 470, Santo Tomás, Miguel Hidalgo, 11340 Ciudad de México, CDMX, México",Error scraping content,Error extracting emails
UNITEC Marina - Universidad Tecnológica de México,https://www.unitec.mx/campus-marina/?utm_source=GOOGLE_MY_BUSINESS&utm_medium=ORGANIC&utm_campaign=GM_MAR_UNITEC&utm_term=CONOCER_CAMPUS&utm_content=PRESTIGIO,+52 800 786 4832,"Av. Marina Nacional 162, Anáhuac I Secc, Miguel Hidalgo, 11320 Ciudad de México, CDMX, México",Error scraping content,Error extracting emails
Universidad Rosario Castellanos Unidad Justo Sierra,https://www.rcastellanos.cdmx.gob.mx/,,"Justo Sierra 49, Centro Histórico de la Cdad. de México, Centro, Cuauhtémoc, 06000 Centro, CDMX, México",Error scraping content,Error extracting emails
"Universidad Obrera de México ""Vicente Lombardo Toledano""",http://www.uom.mx/,+52 55 5702 4087,"San Ildefonso 72, Centro Histórico de la Cdad. de México, Centro, Cuauhtémoc, 06020 Ciudad de México, CDMX, México",Error scraping content,Error extracting emails
ESFM - Escuela Superior de Física y Matemáticas - IPN,https://www.esfm.ipn.mx/,+52 55 5729 6000,"Avenida Instituto Politécnico Nacional s/n Edificio 9 Unidad Profesional “Adolfo López Mateos” Col. San Pedro Zacatenco Del, Nueva Industrial Vallejo, Gustavo A. Madero, 07738 Ciudad de México, México",Error scraping content,Error extracting emails
Departamento de Bioquímica del CINVESTAV,http://biochem.cinvestav.mx/,+52 55 5747 3800 ext. 5231,"de, Av Instituto Politécnico Nacional 2508, San Pedro Zacatenco, Gustavo A. Madero, 07360 Ciudad de México, CDMX, México",Error scraping content,Error extracting emails
Departamento de Genética y Biología Molecular,http://genetica.cinvestav.mx/,+52 55 5747 3800,"Av Instituto Politécnico Nacional 2508, San Pedro Zacatenco, Gustavo A. Madero, 07360 Ciudad de México, CDMX, México",Error scraping content,Error extracting emails
Departamento de Biomedicina molecular,http://biomol.cinvestav.mx/,+52 55 5747 3800,"Av Instituto Politécnico Nacional 2508, San Pedro Zacatenco, Gustavo A. Madero, 07360 Ciudad de México, CDMX, México",Error scraping content,Error extracting emails
Departamento de biotecnología y bioingeniería,http://www.biotecnologia.cinvestav.mx/,+52 55 5747 3800,"Av Instituto Politécnico Nacional 2508, San Pedro Zacatenco, Gustavo A. Madero, 07360 Ciudad de México, CDMX, México",Error scraping content,Error extracting emails
Coordinación General de Planeación e Información Institucional,http://www.ipn.mx/,+52 55 5729 6000,"María Luisa Estampa Ortigoza 283, Nueva Industrial Vallejo, Gustavo A. Madero, 07738 Ciudad de México, CDMX, México",Error scraping content,Error extracting emails
Posgrado en Ciencias en Ingeniería de Telecomunicaciones (PCIT),https://linktr.ee/ipnmcit,+52 57296000,"Unidad Profesional, Adolfo López Mateos Tercer Piso, ESIME Zacatenco, Gustavo A. Madero, 07738 Ciudad de México, CDMX, México",Error scraping content,Error extracting emails
CECUAM Centro Educativo Cumbre de América,http://www.cecuam.mx/,+52 55 4164 5827 ext. 11111,"Canal de Desfogue y esquina Avenida de, Las Flores s/n, Juan González Romero, Gustavo A. Madero, 07410 Ciudad de México, CDMX, México",Error scraping content,Error extracting emails
Universidad ICEL - Campus Zona Rosa,http://www.icel.edu.mx/,+52 55 5350 9100,"Liverpool 59, Juárez, Cuauhtémoc, 06600 Ciudad de México, CDMX, México",Error scraping content,Error extracting emails
CORPORATIVO UNIVERSITARIO PANAMERICANO MÉXICO,http://www.cupmexico.com/,+52 55 7710 4898,"Av. Miguel Othón de Mendizábal Ote. 637, La Escalera, Gustavo A. Madero, 07320 Ciudad de México, CDMX, México",Error scraping content,Error extracting emails
UCAD Universidad en Línea,https://enlinea.ucad.edu.mx/,+52 55 7100 4580,"Av. P.º de la Reforma 26-Oficina 17, Juárez, Cuauhtémoc, 06600 Ciudad de México, CDMX, México",Error scraping content,Error extracting emails
Auditorio de la Coordinación General de Planeación e Información Institucional,http://www.ipn.mx/coplaneval/,,"Nueva Industrial Vallejo, Gustavo A. Madero, 07700 Ciudad de México, CDMX, México",Error scraping content,Error extracting emails
Universidad Michael Faraday,http://www.univmf.edu.mx/,+52 55 5396 3003,"Laguna del Carmen 167, Anáhuac I Secc., Anáhuac I Secc, Miguel Hidalgo, 11320 Ciudad de México, CDMX, México",Error scraping content,Error extracting emails
UMOV Academy Universidad en Línea,https://umov.mx/,+52 55 5001 8359,"Av. Paseo de la Reforma 26. Pisos 17, 20 y 22, 06660 Ciudad de México, CDMX, México",Error scraping content,Error extracting emails
Justo Sierra Universidad Campus Ticomán,https://www.universidad-justosierra.edu.mx/,+52 55 1885 6443,"Calz. Ticomán 892, Col. Barrio Candelaria, Ticoman, Gustavo A. Madero, 07340 Ciudad de México, CDMX, México",Error scraping content,Error extracting emails
EST - Escuela Superior de Turismo - IPN,https://www.est.ipn.mx/,+52 55 5729 6000,"Miguel Bernard 39, La Purísima Ticoman, Gustavo A. Madero, 07630 Ciudad de México, CDMX, México",Error scraping content,Error extracting emails
Universidad Justo Sierra Campus Medicina,https://www.universidad-justosierra.edu.mx/licenciaturas/medico-cirujano-ticoman/,+52 55 5747 8908,"Calz. Ticomán 1111, Residencial Zacatenco, Gustavo A. Madero, 07310 Ciudad de México, CDMX, México",Error scraping content,Error extracting emails
ESIA Unidad Ticomán,https://www.esiatic.ipn.mx/,,"La Purísima Ticoman, Gustavo A. Madero, 07340 Ciudad de México, CDMX, México",Error scraping content,Error extracting emails
ESIME - Escuela Superior de Ingeniería Mecánica y Eléctrica Unidad Azcapotzalco IPN,https://www.esimeazc.ipn.mx/,+52 55 5729 6000,"Av. de las Granjas 682, Santa Catarina, Azcapotzalco, 02550 Ciudad de México, CDMX, México",Error scraping content,Error extracting emails
Instituto Rosario Castellanos Euzkadi,https://rcastellanos.cdmx.gob.mx/,,"Blvd. Ferrocarriles 514-18, Industrial Vallejo, Azcapotzalco, 02300 Ciudad de México, CDMX, México",Error scraping content,Error extracting emails
INSTITUTO GNÓSTICO DE MÉXICO,http://gnosticoazcapo.education/,+52 55 9063 0126,"C. 12 574, Pro Hogar, Azcapotzalco, 02600 Ciudad de México, CDMX, México",Error scraping content,Error extracting emails
"Universidad Pedagogica Nacional, Unidad 095 Azcapotzalco",https://upnunidad095.wixsite.com/website,+52 55 5281 4407,"Avenida, Calz. Azcapotzalco - La Villa 1011, San Andres de las Salinas, Azcapotzalco, 02320 Ciudad de México, CDMX, México",Error scraping content,Error extracting emails
Residencia de Alumnos de la Universidad Pontificia de México,https://www.pontificia.edu.mx/residencias-de-estudiantes-upm/,,"Seminario Núm. 26, Santa Ursula Xitla, Delegación, Tlalpan, CDMX, México",Error scraping content,Error extracting emails
EBC - Campus Ciudad de México Sur,https://www.ebc.mx/campus/ciudad-de-mexico-sur,+52 55 3683 2444,"Anillo Perif. 4407, Jardines en la Montaña, Tlalpan, 14210 Ciudad de México, CDMX, México",Error scraping content,Error extracting emails
UNIVERSIDAD Panamericana,http://prepaup.edu.mx/,+52 55 5424 1280,"Cdad. de León 54, Colonia Miguel Hidalgo Delegación, Tlalpan, 14260 Ciudad de México, CDMX, México",Error scraping content,Error extracting emails
PILARES Juventino Rosas,https://pilares.cdmx.gob.mx/,,"Alfonso Priani, La Guadalupe, La Magdalena Contreras, 10820 Ciudad de México, CDMX, México",Error scraping content,Error extracting emails
"M4thEdu ""Soluciones Escolares""",https://www.facebook.com/M4thedu-1642816569300418,+52 55 6618 0425,"De Las Rosas Mz.27-Lt.15, Torres de Potrero, Álvaro Obregón, 01840 Ciudad de México, CDMX, México",Error scraping content,Error extracting emails
"MICHIWI TIENDA DE COMPUTADORAS PARA ESTUDIANTES DE SECUNDARIA, PREPARATORIA Y UNIVERSIDAD",http://facebook.com/MICHIWIPCTIENDADECOMPUTADORAS,+52 55 5810 8068,"Crisantemo 77, Torres de Potrero, Álvaro Obregón, 01840 Ciudad de México, CDMX, México",Error scraping content,Error extracting emails
PILARES Ferrocarril,https://pilares.cdmx.gob.mx/inicio,+52 55 6581 9438,"10800, F.C. de Cuernavaca 80, Barrio San Francisco, 10500 Ciudad de México, CDMX, México",Error scraping content,Error extracting emails
Instituto General Lazaro Cardenas,https://www.institutolcr.com/,,"Palmas 140, El Rosal, Palmas, Álvaro Obregón, 01060 Ciudad de México, CDMX, México",Error scraping content,Error extracting emails
Universidad Autónoma Metropolitana Unidad Xochimilco,https://www.uam.mx/unidad_xochimilco.html,+52 55 5483 7000,"Calz. del Hueso 1100, Coapa, Villa Quietud, Coyoacán, 04960 Ciudad de México, CDMX, México",Error scraping content,Error extracting emails
Universidad Azteca International Network System,https://www.universidadazteca.net/,+52 55 3092 2489,"Av. San Francisco, Barrio San Francisco, La Magdalena Contreras, 10500 Ciudad de México, CDMX, México",Error scraping content,Error extracting emails
Biblioteca de la Universidad Anáhuac México Campus Sur,http://web.uas.mx/web/biblioteca/default.asp,+52 55 5628 8800,"Av. de las Torres 131, Olivar de los Padres, Álvaro Obregón, 01780 Ciudad de México, CDMX, México",Error scraping content,Error extracting emails
Universidad Rosario Castellanos Magdalena Contreras,https://rcastellanos.cdmx.gob.mx/,,"IRC - CDMX, https://rcastellanos.cdmx.gob.mx, San Bernabé Ocotepec, La Magdalena Contreras, 10300 CDMX, México",Error scraping content,Error extracting emails
CUGENCO (Cursos Generales Para El Conocimiento),https://www.facebook.com/CursosGeneralesParaElConocimiento/,+52 55 2947 2859,"Calle Nogal, Mz 43, Lot 1, Col, Lomas de la Era, Álvaro Obregón, 01860 Ciudad de México, CDMX, México",Error scraping content,Error extracting emails
IELTS México | British Council | Universidad Iberoamericana | Centro Oficial,https://www.britishcouncil.org.mx/examen/ielts/ciudad-de-mexico,+52 55 8920 2688,"Vasco de Quiroga 10, Santa Fe, Zedec Sta Fé, Álvaro Obregón, 01219 Ciudad de México, CDMX, México",Error scraping content,Error extracting emails
Universidad Victoria,http://universidadvictoria.edu.mx/,+52 55 5803 5555,"Coyuya 323, Santa Anita, Iztacalco, 08320 Ciudad de México, CDMX, México",Error scraping content,Error extracting emails
Instituto Mexicano de la Pareja,http://www.ametep.com.mx/,+52 55 5257 0152,"Paseo de la Reforma 2693, Torre, A, 4to. Piso, Col, Lomas de Bezares, Miguel Hidalgo, 11910 Ciudad de México, CDMX, México",Error scraping content,Error extracting emails
Domino's Avenida Universidad,https://www.dominos.com.mx/,+52 55 1454 4532,"Av. Universidad 86, Narvarte Poniente, Benito Juárez, 03020 Ciudad de México, CDMX, México",Error scraping content,Error extracting emails
Centro Educativo Moderno,http://www.colegiocem.mx/,+52 55 9180 3754,"Xola 36, Álamos, Benito Juárez, 03400 Ciudad de México, CDMX, México",Error scraping content,Error extracting emails
Centro de Desarrollo Transpersonal,https://centrotranspersonal.com.mx/,+52 55 6389 8064,"Av. Universidad 54, Narvarte Poniente, Benito Juárez, 03023 Ciudad de México, CDMX, México",Error scraping content,Error extracting emails
INHDEC Medical,https://www.inhdec.com/,,"Eje Central Lázaro Cárdenas, Periodista, Benito Juárez, 03620 Ciudad de México, CDMX, México",Error scraping content,Error extracting emails
Universidad Pedagógica Nacional Unidad Upn 098,https://upn.mx/,+52 55 5630 9700,"Calz. de la Viga, Militar Marte, Iztacalco, 08830 Ciudad de México, CDMX, México",Error scraping content,Error extracting emails
Asegura tu lugar en la Universidad,https://www.facebook.com/lugarasegurado,,"C. Martín Carrera, Campamento 2 de Octubre, Iztacalco, 08930 Ciudad de México, CDMX, México",Error scraping content,Error extracting emails
Instituto de Posgrado en Derecho,http://www.ipd.edu.mx/,+52 55 2614 9659,"Playa Colorada 3006, Reforma Iztaccihuatl Nte., Iztacalco, 08810 Ciudad de México, CDMX, México",Error scraping content,Error extracting emails
Universidad de Carvarg,http://universidaddecarvarg.com/,+52 55 4859 3405,"Eje Central Lázaro Cárdenas 829, Narvarte Oriente, Benito Juárez, 03020 Ciudad de México, CDMX, México",Error scraping content,Error extracting emails
Universidad Tres Culturas | Tlalpan | UTC,https://utc.mx/,+52 800 953 1305,"Calz. de Tlalpan 639, Álamos, Benito Juárez, 03400 Ciudad de México, CDMX, México",Error scraping content,Error extracting emails
UNID Campus Churubusco,http://www.unid.edu.mx/,+52 55 5634 3066,"09400 de, Calz. de la Viga 1390, La Viga, Iztapalapa, 09400 Ciudad de México, CDMX, México",Error scraping content,Error extracting emails
Universidad UEM Churubusco,http://www.uem.edu.mx/,+52 55 6830 0029,"Calz. de la Viga 1425, El Retoño, Iztapalapa, 09440 Ciudad de México, CDMX, México",Error scraping content,Error extracting emails
IUCMA,https://iucma.negocio.site/?utm_source=gmb&utm_medium=referral,+52 967 688 3828,"Julián Villagrán N°18, Morelos, Iztapalapa, 29219 Ciudad de México, Chiapas, México",Error scraping content,Error extracting emails
Universidad Tres Culturas | Observatorio | UTC,https://utc.mx/,+52 55 7657 1857,"Av Observatorio 400, 16 de Septiembre, Miguel Hidalgo, 11810 Ciudad de México, CDMX, México",Error scraping content,Error extracting emails
CENRA,https://miscursoscenra.com/,+52 55 7448 3428,"Nte 86 4309, La Malinche, Gustavo A. Madero, 07890 Ciudad de México, CDMX, México",Error scraping content,Error extracting emails
Club De Tenis Axomiatla Sa De Cv,https://www.clubaxomiatla.com/,+52 55 5635 1828,"Odisea 26, Lomas de Axomiatla, Álvaro Obregón, 01820 Ciudad de México, CDMX, México",Error scraping content,Error extracting emails
Educación Continua Unam,https://educacioncontinua.unam.mx/,,"C. de Tacuba 5, Centro Histórico de la Cdad. de México, Centro, Cuauhtémoc, 06000 Ciudad de México, CDMX, México",Error scraping content,Error extracting emails
Prepa TEC,https://tec.mx/es/prepatec?utm_source=gmb-santafe&utm_medium=organic,+52 55 9177 8000,"Av Carlos Lazo 100, Santa Fe, La Loma, Álvaro Obregón, 01389 Ciudad de México, CDMX, México",Error scraping content,Error extracting emails
(CUNB) Centro Universitario Nicolas Bravo,http://cunb.com.mx/,+52 55 5751 8383,"Av. Rio Consulado N°208, Siete de Noviembre, Gustavo A. Madero, 07840 Ciudad de México, CDMX, México",Error scraping content,Error extracting emails
"Fundación Mexicana Para la Educación, la Tecnología y la Ciencia",https://www.funedmx.org/,+52 55 5292 1428 ext. 1101,"Prol. P.º de la Reforma 115, Santa Fe, Paseo de las Lomas, Cuajimalpa de Morelos, 01330 Ciudad de México, CDMX, México",Error scraping content,Error extracting emails
EGADE Business School,https://egade.tec.mx/,+52 55 9177 8090,"Av Carlos Lazo 100, Santa Fe, La Loma, Álvaro Obregón, 01389 Ciudad de México, CDMX, México",Error scraping content,Error extracting emails
"Universidad Pedagógica Nacional, Unidad 099, Ciudad de México, Poniente",https://upn099.mx/,+52 55 5639 8826,"La Morena 811, Narvarte Poniente, Benito Juárez, 03020 Ciudad de México, CDMX, México",Error scraping content,Error extracting emails
"CCH Sur, Sala Audiovisual",http://www.cch-sur.unam.mx/,,"Colegio, Jardines del Pedregal, Coyoacán, 04500 Ciudad de México, CDMX, México",Error scraping content,Error extracting emails
UPN-Unidad 097,http://u097.upnvirtual.edu.mx/,+52 55 5630 9700,"Periferico Sur 3313, San Jerónimo Aculco, Álvaro Obregón, 01900 Ciudad de México, CDMX, México",Error scraping content,Error extracting emails
Centro de Estudios de Opinión Pública,https://www.politicas.unam.mx/ceop/,+52 55 8423 1757,"Cto. Estadio Olímpico Universitario s/n, C.U., Coyoacán, 04510 Ciudad de México, CDMX, México",Error scraping content,Error extracting emails
Tecmilenio Artz Pedregal,http://universidad.tecmilenio.mx/campus-artz-pedregal-modalidad-connect,+52 55 2716 1493,"Dentro de Wework Artz Pedregal, Anillo Perif. 3720, Jardines del Pedregal, Álvaro Obregón, 01900 Ciudad de México, CDMX, México",Error scraping content,Error extracting emails
"Instituto de Ecología, UNAM",http://www.ecologia.unam.mx/,+52 55 5622 8996,"C.U., Coyoacán, 04510 Ciudad de México, CDMX, México",Error scraping content,Error extracting emails
Unidad de Transparencia de la UNAM,http://www.transparencia.unam.mx/,+52 55 5622 0473,"Lado nor-poniente del Estadio, Olímpico, C.U., 04510 Ciudad de México, CDMX, México",Error scraping content,Error extracting emails
"Hospital Universidad, Sc",http://www.soyabuelo.com.mx/,+52 55 5568 3810,"Lluvia 481, Jardines del Pedregal, Álvaro Obregón, 01900 Ciudad de México, CDMX, México",Error scraping content,Error extracting emails
WOW U La Universidad Online del Efecto WOW,https://www.thewowu.com/,,"Petrarca 122, Polanco, Polanco V Secc, Miguel Hidalgo, 11560 Ciudad de México, CDMX, México",Error scraping content,Error extracting emails
Develop Soluciones y Tecnología,http://www.develop.com.mx/,+52 55 5557 5012,"Presa Santa Teresa 176, Col. Irrigación, Miguel Hidalgo, 11500 Ciudad de México, CDMX, México",Error scraping content,Error extracting emails
VATEL INTERNATIONAL BUSINESS SCHOOL HOTEL & TOURISM MANAGEMENT,https://www.vatel.mx/,+52 55 1209 1963,"Calle Sócrates 156, Polanco, Polanco II Secc, Miguel Hidalgo, 11530 Ciudad de México, CDMX, México",Error scraping content,Error extracting emails
Instituto de Estudios Transgeneracionales,https://www.psicologiatransgeneracional.com/,+52 55 4522 1180,"Emerson 119, Polanco, Polanco Chapultepec, Miguel Hidalgo, 11560 Ciudad de México, CDMX, México",Error scraping content,Error extracting emails
Instituto DCK Cuitlahuac Formación Profesional y de Negocios,http://www.dckcuitlahuac.com/,+52 55 7159 0915,"Calz México-Tacuba 631, Tacuba, Miguel Hidalgo, 11410 Ciudad de México, CDMX, México",Error scraping content,Error extracting emails
Instituto Bert Hellinger De Mexico,http://www.psicologiatransgeneracional.com/,+52 55 5255 5510,"Emerson 119, Polanco, Polanco V Secc, Miguel Hidalgo, 11560 Ciudad de México, CDMX, México",Error scraping content,Error extracting emails
IPADE Business School (Instituto Panamericano de Alta Dirección de Empresa),http://www.ipade.mx/,+52 55 5354 1800,"Calle Floresta 20, Claveria, Azcapotzalco, 02080 Ciudad de México, CDMX, México",Error scraping content,Error extracting emails
Centro Universitario Jl Francisco Larroyo Sc,http://cufl.edu.mx/,+52 55 5842 1261,"Av. Tlahuac 7367, Santa Cecilia, Tláhuac, 13010 Ciudad de México, CDMX, México",Error scraping content,Error extracting emails
UNIVERSIDAD TOMINAGA NAKAMOTO,http://www.utominaga.edu.mx/,+52 55 6251 3455,"Luis Freg #6, Lomas de Sotelo, 53390 Naucalpan de Juárez, Méx., México",Error scraping content,Error extracting emails
Universidad Tres Culturas | Toreo | UTC,https://www.utc.mx/,+52 55 7261 7597,"Ingenieros Militares Calzada México-Tacuba 160, Esquina, Argentina Poniente, Miguel Hidalgo, 11230 Ciudad de México, México",Error scraping content,Error extracting emails
